{
  "typeId": "roborean.sheet_set_cells",
  "version": "1.0.0",
  "configSchema": {
    "type": "object",
    "required": ["documentId"],
    "properties": {
      "documentId": { "type": "string" },
      "cells": { "type": "array" },
      "formulas": { "type": "array" }
    },
    "additionalProperties": false
  },
  "effectClass": "document",
  "capabilities": ["document.write"],
  "readsFromConfig": true,
  "browserSafe": false
}
